{
  "schema_version": "1.0",
  "receipt_id": "G2EVIDENCE-CAMPAIGN-PROTOCOL-20260820-01-PREPARATION-RECEIPT",
  "protocol_sha256": "f9f5cd0c5d2b612cf22050b4bb588851522758ba5166a1d66a2d9650bbc0ce90",
  "material_distinct_frame": {
    "path": "data/methods/g2/G2MATERIAL-DISTINCT-20260820-01/design/candidate-frame.json",
    "sha256": "ef012e94dddfc37820b17301eaa423f4dc0dbd3a64c139e55cf902c6850178b3"
  },
  "material_distinct_receipt": {
    "path": "data/methods/g2/G2MATERIAL-DISTINCT-20260820-01/design/preparation-receipt.json",
    "sha256": "07aac92ff15c143f8f527a3084644781b7df8ddc2cb9145afdf0171a891e3f47"
  },
  "candidate_manifest_available": false,
  "external_activity_authorized": false,
  "source_content_accessed": false,
  "outcome": "blocked_no_unexposed_candidate_manifest"
}
